"team .colname","total .colname","attack .colname","defense .colname","n .colname","region .colname","city .colname","fall.league .colname","other .colname"
"Crossfire Premier USSDA B03",2015,99.47,45.78,8,"WA","Redmond","",""
"Seattle United Copa B03",1893,55.89,34.91,47,"WA","Seattle","RCL B03 Div 1",""
"Crossfire Premier A B03",1832,37.18,34.32,52,"WA","Redmond","RCL B03 Div 2",""
"NW United Black B03",1825,35.84,34.03,49,"WA","Burlington","RCL B03 Div 1",""
"PacNW Maroon B03",1819,44.99,25.93,48,"WA","Tukwila","RCL B03 Div 1",""
"WA Rush B03",1779,41.09,21.6,47,"WA","Everett","RCL B03 Div 1",""
"FC Portland Navy B03",1748,36.64,19.45,30,"OR","Portland","PTT B03 Div 1 Green",""
"WPFC Black B03",1743,43.2,16.01,42,"WA","Tacoma","RCL B03 Div 1",""
"Idaho Rush Premier B03",1742,30.43,22.54,14,"ID","Boise","",""
"GS Surf A B03",1735,29.38,22.16,37,"WA","Bothel","RCL B03 Div 1",""
"Seattle United Tango B03",1733,35.23,18.29,36,"WA","Seattle","RCL B03 Div 1",""
"Eastside FC Red B03",1733,46.41,13.84,41,"WA","Preston","RCL B03 Div 1",""
"Crossfire Yakima B B03",1689,20.01,23.73,13,"WA","Sunnyside","",""
"Westside Timbers Copa B03",1684,27.61,16.59,49,"OR","Beaverton","PTT B03 Div 1 Green",""
"Snohomish United Black B03",1675,30.99,13.9,45,"WA","Snohomish","RCL B03 Div 2",""
"Salem Chelsea B03",1671,29.85,14.07,29,"OR","Salem","PTT B03 Div 1 Green",""
"Eastside Timbers Black 1 B03",1652,13.45,27.27,10,"OR","Gresham","",""
"Capital FC Timbers Red B03",1651,18.58,19.69,26,"OR","Salem","",""
"4-H FC Joga B03",1638,31.82,10.43,17,"OR","","",""
"Washington Timbers Red 1 B03",1636,23.62,13.96,38,"WA","Vancouver","RCL B03 Div 2",""
"4-H McMinnville United B03",1636,38.47,8.56,14,"OR","","PTT B03 Div 1 Green",""
"NPSA Titans Navy B03",1634,25.25,12.83,36,"WA","Bellevue","PSPL WNPL U15","WA Cup Gold U15"
"Dragons FC B03",1634,27.33,11.83,41,"WA","Seattle","PSPL WNPL U15","WA Cup Gold U15"
"WAFC Real Madrid B03",1633,30.31,10.62,21,"OR","Woodburn","",""
"LASC Cuervos B03",1631,26.23,12.08,14,"OR","NE Portland","PTT B03 Div 1 Green",""
"Washington East SC B03",1623,14.82,20.27,32,"WA","Spokane","PSPL WNPL U15",""
"PacNW Blue B03",1616,26.82,10.66,43,"WA","Tukwila","RCL B03 Div 2",""
"Crossfire Premier B B03",1610,22.72,12.06,38,"WA","Redmond","RCL B03 Div 4",""
"GPS Oregon B03",1604,26.57,9.91,26,"OR","","PSPL WSPL 1 U15",""
"ISC Gunners A B03",1601,18.2,14.2,48,"WA","Issaquah","PSPL WNPL U15","WA Cup Gold U15"
"Spokane Sounders A B03",1599,18.29,13.88,34,"WA","Spokane","RCL B03 Div 3",""
"Blackhills FC Black B03",1598,23.19,10.87,38,"WA","Olympia","RCL B03 Div 3",""
"Wenatchee FC Black B03",1593,17.29,14.12,33,"WA","Wenatchee","PSPL WNPL U15","WA Cup Gold U15"
"Eastside FC White B03",1592,17.41,13.95,50,"WA","Preston","RCL B03 Div 2",""
"STU Chelsea Academy B03",1579,20.04,11.06,37,"WA","Tacoma","RCL B03 Div 4",""
"Southside SC Azul B03",1573,17.33,12.22,35,"OR","Tigard","PTT B03 Div 1 White",""
"HSC Bayern B03",1572,19.07,11.07,26,"OR","Hillsboro","",""
"Eastside Timbers Red B03",1568,21.75,9.42,38,"OR","Gresham","PTT B03 Div 1 Green",""
"Pumas UNAM B03",1568,18.99,10.77,11,"WA","Seattle","",""
"FC Portland White B03",1564,15.89,12.59,20,"OR","Portland","",""
"Academia de Futebol ADF B03",1563,14.79,13.42,29,"OR","Portland","",""
"Kent United Green B03",1560,16.56,11.71,53,"WA","Kent","RCL B03 Div 4",""
"CGA Academy SC Sounders B03",1554,17.65,10.55,13,"ID","","",""
"Tri-Cities B03",1548,17.43,10.27,20,"WA","","PSPL Copa 1 - East U15","WA Cup Silver U15"
"WPFC White B03",1546,12.2,14.41,46,"WA","Tacoma","RCL B03 Div 2",""
"FWFC Blue B03",1546,14.72,11.93,34,"WA","Federal Way","RCL B03 Div 2",""
"NEU White B03",1542,16.1,10.68,18,"OR","Portland","",""
"PCU Red 1 B03",1540,14.94,11.27,26,"OR","Portland","",""
"FC Nova Gold B03",1538,17.9,9.32,21,"ID","Boise","",""
"Crossfire Yakima A B03",1538,24.86,6.71,33,"WA","Yakima","RCL B03 Div 3",""
"Boise Nationals Timbers Blue B03",1536,14.54,11.32,26,"ID","Boise","",""
"Whatcom Rangers Gold B03",1534,18.37,8.84,37,"WA","Bellingham","RCL B03 Div 4",""
"Crossfire Oregon Green I B03",1534,15.6,10.38,35,"OR","Lake Oswego","PTT B03 Div 1 Green",""
"NSC Green B03",1518,16.57,8.76,22,"WA","Woodinvile","NPSL DIVISION 1 (03) U15",""
"THUSC Beryllium Black B03",1512,13.15,10.58,23,"OR","Beaverton","",""
"Central WA SA Rave Green B03",1507,20.61,6.52,13,"WA","Yakima","PSPL WSPL 1 U15","WA Cup Gold U15"
"Wenatchee Valley Othello United B03",1506,15.97,8.35,18,"WA","Othello","PSPL Classic 1 - East U15",""
"Pumas UNAM B B03",1504,15.42,8.53,26,"WA","Seattle","PSPL WNPL U15","WA Cup Gold U15"
"Emerald City FC Green B03",1500,14.18,9.01,30,"WA","Seattle","PSPL WSPL 1 U15",""
"Central WA SA Navy B03",1493,20.77,5.89,32,"WA","Yakima","PSPL WSPL 1 U15","WA Cup Gold U15"
"4-H Atletico B03",1493,19.69,6.19,26,"OR","","PTT B03 Div 1 White",""
"Liga Tlaxtli FC Guerreros B03",1492,15.97,7.6,42,"WA","","PSPL WSPL 1 U15",""
"Wenatchee Valley United Blue B03",1491,15.98,7.55,14,"WA","Wenatchee","PSPL Copa 2 - East U15","WA Cup Bronze U15"
"Seattle United Samba B03",1489,13.14,9.04,42,"WA","Seattle","RCL B03 Div 3",""
"HSC Velez B03",1488,10.41,11.31,15,"OR","Hillsboro","",""
"GS Surf B B03",1482,15.04,7.53,38,"WA","Bothel","RCL B03 Div 2",""
"Seattle United Shoreline Blue B03",1475,10.34,10.41,28,"WA","Shoreline","NPSL DIVISION 1 (03) U15",""
"Toluca Portland SC Elite B03",1472,14.26,7.4,22,"OR","","PTT B03 Div 1 White","OYS Founders Cup B03"
"Harbor Premier Green B03",1462,14.02,7,47,"WA","Gig Harbor","RCL B03 Div 3",""
"LWPFC White Piranhas B03",1458,13.42,7.15,40,"WA","Redmond","PSPL WSPL 1 U15","WA Cup Gold U15"
"Wenatchee Valley United White B03",1456,12.41,7.62,15,"WA","Wenatchee","PSPL Classic 1 - East U15",""
"Idaho Rush Nero B03",1436,12.4,6.63,15,"ID","Boise","",""
"Sting SC Timbers Red B03",1431,12.98,6.1,32,"ID","Coeur D'Alene","PSPL Copa 1 - East U15",""
"ETFC Ajax Black B03",1430,10.58,7.45,19,"OR","Eugene","",""
"Bend FC Timbers Red B03",1428,9.48,8.18,33,"OR","Bend","PTT B03 Div 1 Green",""
"Eastside FC Blue B03",1427,13.7,5.61,39,"WA","Preston","RCL B03 Div 4",""
"Washington Timbers Red 2 B03",1426,10.83,7.1,42,"WA","Vancouver","RCL B03 Div 3",""
"Highline Select Blue B03",1418,9.35,7.73,18,"WA","Burien","NPSL DIVISION 2 (03) U15",""
"NSC Impact B03",1416,10.27,6.99,22,"WA","Woodinvile","NPSL DIVISION 2 (03) U15",""
"3 Rivers Black B03",1412,13.71,5.07,33,"WA","Pasco","RCL B03 Div 3",""
"NK Fire B03",1410,10.1,6.77,32,"WA","Poulsbo","NPSL DIVISION 1 (03) U15",""
"IDA-ORE FC Tigers Ontario B03",1408,16.22,4.17,17,"ID","","",""
"Kent United Gonzalez B03",1407,11.18,5.99,27,"WA","Kent","PSPL WSPL 1 U15",""
"Seattle Celtic Green B03",1399,11.53,5.51,34,"WA","Seattle","PSPL WSPL 2 U15","WA Cup Silver U15"
"FPSC Fury Black B03",1399,12.13,5.24,33,"WA","Tacoma","PSPL WSPL 2 U15","WA Cup Silver U15"
"NSC Fury B03",1397,6.94,9.06,15,"WA","Woodinvile","",""
"Aguilas Seattle FC Lions B03",1393,15.97,3.83,10,"WA","","PSPL WSPL 2 U15",""
"Fuerza FC Academy B03",1392,9.26,6.55,21,"WA","Marysville","PSPL Copa 1 - West U15",""
"PCU White B03",1391,12.03,5,11,"OR","Portland","",""
"PCU Black 1 B03",1388,11.73,5.01,37,"OR","Portland","PTT B03 Div 1 White",""
"BIFC Blue B03",1387,11.39,5.13,33,"WA","Bainbridge Island","NPSL DIVISION 1 (03) U15",""
"Washington Timbers White 1 B03",1386,8.24,7.06,27,"WA","Vancouver","PTT B03 Div 1 White",""
"WA Rush Nero B03",1383,9.19,6.17,43,"WA","Everett","RCL B03 Div 4",""
"HSC Bayern Red B03",1381,7.65,7.33,17,"OR","Hillsboro","PTT B03 Div 1 White",""
"FC Edmonds Velocity B03",1380,10.22,5.47,35,"WA","Edmonds","PSPL Classic 2 - West U15","WA Cup Bronze U15"
"Pacific FC United B03",1376,9.23,5.89,32,"WA","Battle Ground","PTT B03 Div 1 White",""
"Irish Lions B03",1376,13.97,3.87,20,"WA","Mukilteo","NPSL DIVISION 2 (03) U15",""
"NW United Red B03",1372,8.59,6.12,42,"WA","Burlington","RCL B03 Div 5",""
"RVSC Timbers Red B03",1368,11.39,4.5,25,"OR","Medford","PTT B03 Div 1 White",""
"PacNW White B03",1362,8.51,5.78,44,"WA","Tukwila","RCL B03 Div 3",""
"MVP Rapids Navy B03",1362,8.77,5.59,34,"WA","Maple Valley","PSPL Classic 1 - West U15","WA Cup Silver U15"
"Tynecastle FC B03",1358,8.06,5.93,21,"WA","Everett","PSPL WSPL 2 U15","WA Cup Silver U15"
"Westside Timbers Samba B03",1356,6.71,7.03,32,"OR","Beaverton","",""
"Idaho Rush Azul B03",1356,9.3,5.06,17,"ID","Boise","",""
"Seattle United W Blue B03",1352,9.49,4.84,32,"WA","Seattle","NPSL DIVISION 1 (03) U15",""
"Breakers Black B03",1346,7.8,5.66,32,"WA","Spokane","PSPL Classic 1 - East U15","WA Cup Silver U15"
"Nortac Sparta Red B03",1346,10.32,4.26,29,"WA","Tacoma","PSPL Classic 2 - West U15","WA Cup Bronze U15"
"NPSA Titans White B03",1340,8.19,5.14,34,"WA","Bellevue","PSPL WSPL 2 U15","WA Cup Silver U15"
"Kent United White B03",1339,10.02,4.19,40,"WA","Kent","NPSL DIVISION 1 (03) U15",""
"Crossfire Oregon Green II B03",1339,7.82,5.35,26,"OR","Lake Oswego","PTT B03 Div 2 Green",""
"Cascade FC Green B03",1328,12.22,3.17,31,"WA","North Bend","PSPL Classic 1 - West U15","WA Cup Bronze U15"
"River Plate SC River B03",1327,12.1,3.19,27,"OR","NE Portland","PTT B03 Div 2 Green","OYS Founders Cup B03"
"Crossfire Select Allen B03",1323,12.14,3.1,40,"WA","Redmond","NPSL DIVISION 1 (03) U15",""
"NEU Blue B03",1322,9.29,4,29,"OR","Portland","PTT B03 Div 1 White",""
"CSC Storm Navy B03",1322,7.87,4.72,21,"OR","Corvallis","PTT B03 Div 2 Green",""
"Kent City White B03",1314,8.52,4.14,21,"WA","Kent","PSPL WSPL 2 U15","WA Cup Silver U15"
"BSC Portland Black B03",1313,11.39,3.07,20,"OR","Portland","PTT B03 Div 2 Green",""
"Hawks SC B03",1312,10.58,3.28,20,"WA","Pullman","PSPL Copa 2 - East U15",""
"WPFC Navy B03",1309,7.26,4.7,37,"WA","Tacoma","RCL B03 Div 5",""
"GHYSA Real Pacific Jr B03",1302,9.15,3.56,25,"WA","","NPSL DIVISION 2 (03) U15",""
"STU Evolution Blanco B03",1298,7,4.51,18,"WA","Tacoma","NPSL DIVISION 1 (03) U15",""
"North Central Racers B03",1297,10.62,2.96,10,"WA","","PSPL Copa 2 - East U15",""
"LWPFC White Barracudas B03",1297,7.66,4.08,26,"WA","Redmond","PSPL Classic 1 - West U15","WA Cup Silver U15"
"Crossfire Oregon Black B03",1296,9.07,3.43,9,"OR","Lake Oswego","",""
"Southside SC Blanco B03",1296,7.11,4.36,31,"OR","Tigard","PTT B03 Div 2 Green","OYS Founders Cup B03"
"Academia Leon B03",1295,8.02,3.85,11,"OR","Beaverton","PTT B03 Div 1 Green",""
"Seattle United S Blue B03",1291,7.15,4.19,26,"WA","Seattle","NPSL DIVISION 1 (03) U15",""
"Seattle United NE Blue B03",1287,10.98,2.67,27,"WA","Seattle","NPSL DIVISION 2 (03) U15",""
"Pacific FC Real B03",1286,9.72,2.99,30,"WA","Battle Ground","PTT B03 Div 1 White","OYS Founders Cup B03"
"Bend FC Timbers White B03",1282,8.84,3.19,17,"OR","Bend","",""
"Eastside Timbers Black 2 B03",1276,6.17,4.39,19,"OR","Gresham","",""
"Crossfire Premier C B03",1268,9.21,2.78,38,"WA","Redmond","RCL B03 Div 5",""
"TUSK Lil Sounders B03",1265,7.66,3.28,14,"WA","Tukwila","SSUL B03 Div 4",""
"Mukilteo Rush B03",1250,4.56,4.95,30,"WA","Mukilteo","NPSL DIVISION 2 (03) U15",""
"FC Spokane Black Zettle B03",1248,7.21,3.09,13,"WA","Spokane","PSPL Classic 1 - East U15",""
"Foothills SC Celtic White B03",1241,7.44,2.86,20,"OR","Portland","PTT B03 Div 2 Green",""
"TC United Navy B03",1240,7,3.02,30,"WA","Lacey","PSPL Classic 2 - West U15","WA Cup Bronze U15"
"Highline Premier Heat Blue B03",1240,4.54,4.64,29,"WA","Burien","PSPL Copa 1 - West U15","WA Cup Bronze U15"
"Emerald City FC White B03",1239,6.69,3.13,27,"WA","Seattle","PSPL Classic 2 - West U15","WA Cup Bronze U15"
"Blackhills FC Red B03",1236,5.49,3.73,36,"WA","Olympia","RCL B03 Div 5",""
"NC Alliance Rebels B03",1229,5.73,3.41,22,"WA","","PSPL Classic 2 - West U15","WA Cup Bronze U15"
"GPS Newberg B03",1225,6.99,2.73,11,"OR","","",""
"FC Alianza B03",1225,7.52,2.53,21,"ID","","",""
"3 Rivers White B03",1225,7.23,2.63,22,"WA","Pasco","PSPL Copa 1 - East U15",""
"Spokane Sounders B B03",1222,3.69,5.06,36,"WA","Spokane","RCL B03 Div 4",""
"LASC Guerreros B03",1218,4.86,3.73,10,"OR","NE Portland","PSPL Copa 1 - West U15",""
"GS Surf C B03",1216,5.8,3.09,41,"WA","Bothel","RCL B03 Div 4",""
"Eagleclaw FA Golden Eagles B03",1213,3.86,4.55,23,"WA","Seattle","PSPL Classic 1 - West U15","WA Cup Silver U15"
"Newport FC B03",1213,5.91,2.96,29,"WA","Bellevue","NPSL DIVISION 3 (03) U15",""
"PSA Force Black B03",1212,5.43,3.2,27,"WA","Marysville","NPSL DIVISION 2 (03) U15",""
"FWFC White B03",1206,5.11,3.27,40,"WA","Federal Way","RCL B03 Div 5",""
"Fircrest Eagles B03",1205,6.02,2.76,9,"WA","","SSUL B03 Div 4",""
"SSC Shadow Elite Sonko B03",1205,7.23,2.29,25,"WA","Spokane Valley","PSPL Copa 2 - East U15",""
"ISC Gunners B B03",1205,5.66,2.92,36,"WA","Issaquah","PSPL Classic 1 - West U15","WA Cup Silver U15"
"Wenatchee FC B B03",1203,6.26,2.62,21,"WA","Wenatchee","PSPL Copa 1 - East U15",""
"NSC Inferno B03",1190,5.94,2.52,25,"WA","Woodinvile","NPSL DIVISION 3 (03) U15",""
"Spokane Pumas B03",1183,5.29,2.69,23,"WA","Spokane","PSPL Copa 1 - East U15",""
"FME Xtreme B03",1179,5.51,2.51,23,"WA","Milton","NPSL DIVISION 3 (03) U15",""
"Kitsap Alliance FC Red B03",1173,4.52,2.94,32,"WA","Silverdale","RCL B03 Div 5",""
"Eastside FC Grey B03",1169,5.94,2.18,36,"WA","Preston","RCL B03 Div 5",""
"Lake Hills Lightning B03",1169,6.23,2.07,21,"WA","Bellevue","NPSL DIVISION 1 (03) U15",""
"West Narrows Blue B03",1168,5.44,2.35,30,"WA","Gig Harbor","PSPL Classic 2 - West U15",""
"RSA Elite B03",1166,5.18,2.44,24,"WA","Puyallup","PSPL Classic 2 - West U15","WA Cup Bronze U15"
"Snohomish United Red B03",1155,5.15,2.27,38,"WA","Snohomish","NPSL DIVISION 2 (03) U15",""
"WS Blue Rockets B03",1147,6.26,1.77,9,"WA","West Seattle","SSUL B03 Div 4",""
"Leavenworth Storm B03",1146,5.05,2.18,21,"WA","Leavenworth","PSPL Classic 1 - East U15",""
"Oregon Trail SC Thunder B03",1141,6.2,1.72,22,"OR","","PTT B03 Div 2 Green","OYS Founders Cup B03"
"Seattle United W White B03",1140,5.13,2.06,28,"WA","Seattle","NPSL DIVISION 3 (03) U15",""
"Westside Timbers Mundial B03",1140,3.07,3.43,32,"OR","Beaverton","PTT B03 Div 1 White",""
"FPSC Fury White B03",1139,2.83,3.71,20,"WA","Tacoma","PSPL Classic 1 - West U15","WA Cup Silver U15"
"NPSA Titans Red B03",1138,5.18,2.01,10,"WA","Bellevue","PSPL Copa 1 - West U15",""
"Impact FC Black B03",1137,5.15,2,28,"WA","Renton","PSPL Copa 1 - West U15",""
"Seattle United Shoreline White B03",1135,4.19,2.44,24,"WA","Shoreline","NPSL DIVISION 3 (03) U15",""
"Storm King B03",1130,5.12,1.93,17,"WA","Port Angeles","NPSL DIVISION 2 (03) U15",""
"Idaho Arsenal United B03",1127,5.24,1.85,20,"ID","Nampa","Idaho D3 Div 2 U14",""
"South Whidbey Islanders B03",1119,4.84,1.88,20,"WA","Clinton","NPSL DIVISION 3 (03) U15",""
"KVJSA Ellensburg FC B03",1116,4.41,2.02,9,"WA","Ellensburg","PSPL Copa 1 - East U15",""
"Mercer Island FC Arsenal B03",1112,3.86,2.25,19,"WA","Mercer Island","NPSL DIVISION 2 (03) U15",""
"Crossfire Select Downing B03",1110,4.93,1.74,17,"WA","Redmond","NPSL DIVISION 2 (03) U15",""
"IEYSA Storm B03",1104,4.33,1.9,18,"WA","Cheney","PSPL Classic 1 - East U15",""
"THUSC Fluorine B03",1103,3.41,2.39,23,"OR","Beaverton","PTT B03 Div 2 Green",""
"PCU Black 2 B03",1095,2.75,2.81,10,"OR","Portland","PTT B03 Div 2 Green",""
"IEYSA Valor Maroon B03",1094,4.16,1.84,18,"WA","Cheney","PSPL Copa 2 - East U15",""
"Sherwood Fusion B03",1088,4.49,1.64,10,"OR","","PTT B03 Div 2 Green",""
"North Idaho Inferno Blue B03",1081,4.07,1.73,13,"ID","Post Falls","PSPL Copa 2 - East U15",""
"Seattle Celtic White B03",1067,4.44,1.43,23,"WA","Seattle","PSPL Copa 1 - West U15",""
"Wenatchee Valley United Equipo Relampago B03",1066,3.49,1.81,18,"WA","Othello","PSPL Copa 1 - East U14",""
"FWFC Chaos B03",1056,3.94,1.5,10,"WA","Federal Way","SSUL B03 Div 4",""
"Vashon SeaDogs B03",1050,4.96,1.14,10,"WA","Vashon Island","SSUL B03 Div 4",""
"Breakers Red B03",1039,3.75,1.4,20,"WA","Spokane","PSPL Copa 1 - East U15",""
"MpVSA Strykeforce B03",1001,3.6,1.12,10,"WA","Maple Valley","SSUL B03 Div 4",""
"Nortac Pact B03",994,2.55,1.5,10,"WA","Tacoma","SSUL B03 Div 4",""
"Emerald City FC Blue B03",976,2.53,1.34,20,"WA","Seattle","PSPL Copa 1 - West U15","WA Cup Bronze U15"
"Mukilteo Rush Nero B03",973,2.96,1.12,18,"WA","Mukilteo","NPSL DIVISION 3 (03) U15",""
"FC Spokane Black Sossaman B03",969,2.69,1.2,17,"WA","Spokane","PSPL Copa 1 - East U15",""
"Shoreline Sportsverrou B03",904,3.09,0.66,10,"WA","Shoreline","PSPL Copa 1 - West U15",""
"SGESC Fusion B03",887,1.88,0.97,14,"WA","Graham","PSPL Classic 2 - West U15",""
"NWSC Deception FC B03",878,2.1,0.82,21,"WA","Oak Harbor","NPSL DIVISION 3 (03) U15",""
"Norpoint Force B03",728,0.84,0.72,10,"WA","Tacoma","SSUL B03 Div 4",""
